"","Headline","Publication","Summary","Date"
"265","10m expected to escape poverty","China Daily, 588 words",NA,2019-12-23
"266","Visitors can explore maze of minerals at Koktokay township's mining site","China Daily, 347 words",NA,2019-07-19
"267","Leaked documents get distorted makeover","China Daily, 512 words",NA,2019-11-28
"268","Village relies on farm tech to bring in fortune","China Daily, 351 words",NA,2019-07-18
"269","New airport approved in autonomous region","China Daily, 360 words",NA,2019-07-17
"270","Xi urges closer ties with Micronesia","China Daily, 569 words",NA,2019-12-14
"271","Inner Mongolia to spur innovation in efforts to combat desertification","China Daily, 479 words",NA,2019-09-27
"272","Fighting extinction with folk songs","China Daily, 594 words",NA,2020-01-24
"273","Xinjiang homes benefit from natural gas project","China Daily, 338 words",NA,2019-07-16
"274","Shale oil efforts gather momentum","China Daily, 862 words",NA,2019-06-12
"275","UN envoys pay visit to Xinjiang to realize region's achievements","China Daily, 446 words",NA,2019-09-05
"276","UN envoy bristles at interference","China Daily, 465 words",NA,2019-10-24
"277","IN BRIEF (Page 2)","China Daily, 347 words",NA,2019-07-06
"278","Diplomat: Stability key to Xinjiang gains","China Daily, 363 words",NA,2019-07-06
"279","Free haircuts offered as medical staff shave to stave off infection","China Daily, 639 words",NA,2020-02-18
"280","Thunderstorms, heat waves expected to increase stress on college applicants","China Daily, 335 words",NA,2019-06-05
"281","Xinjiang embraces future with vitality and stability","China Daily, 1093 words",NA,2019-09-30
"282","Man set free after 10-year battle to overturn ruling","China Daily, 571 words",NA,2019-12-04
"283","Mercedes-Benz backs new SUV to maintain edge in China market","China Daily, 417 words",NA,2019-08-26
"284","Tourists looking longingly at holidays on eased outbreak","China Daily, 825 words",NA,2020-04-01
"285","Disease spurs online psychological counseling service","China Daily, 747 words",NA,2020-02-12
"286","China leads in renewable energy sector","China Daily, 700 words",NA,2020-02-05
"287","Xinjiang 's stability, prosperity impressive to foreign scholars","China Daily, 379 words",NA,2019-08-01
"288","Draft seeks welfare standard for goats","China Daily, 447 words",NA,2019-08-05
"289","China helps Pakistan tackle locust plague","China Daily, 761 words",NA,2020-02-28
"290","On chinadaily.com.cn","China Daily, 424 words",NA,2019-07-11
"291","Linking HK with trade deal not in Washington's favor","China Daily, 403 words",NA,2019-08-21
"292","Hong Kong is not its backyard, and the US should know that","China Daily, 462 words",NA,2019-09-10
"293","Letter about human rights in Xinjiang called groundless effort to smear China","China Daily, 397 words",NA,2019-07-12
"294","IN BRIEF (Page 4)","China Daily, 342 words",NA,2019-05-07
"295","Xinjiang serves as a model of human rights protection","China Daily, 1006 words",NA,2019-07-06
"296","State-owned oil, gas firms help maintain economic stability","China Daily, 746 words",NA,2020-02-20
"297","Pompeo's remarks about Xinjiang both ridiculous and irresponsible","China Daily, 462 words",NA,2019-09-24
"298","Finished expressway connects isolated Xinjiang prefecture","China Daily, 426 words",NA,2019-08-03
"299","Transport network drives local economy","China Daily, 503 words",NA,2019-09-17
"300","Poverty relief money lifting poorest regions","China Daily, 391 words",NA,2019-06-27
"301","More room to roam for protected flocks of Marco Polo sheep","China Daily, 394 words",NA,2019-07-04
"302","Unified high school textbooks put emphasis on traditional values","China Daily, 479 words",NA,2019-08-28
"303","Beijing criticizes report on Xinjiang","China Daily, 374 words",NA,2019-06-25
"304","West has to discard prejudice to see real Xinjiang","China Daily, 444 words",NA,2019-08-17
"305","Slow pace of life makes foreigners feel at home","China Daily, 530 words",NA,2019-11-04
"306","US called on to end visa restrictions over Xinjiang","China Daily, 522 words",NA,2019-10-10
"307","Separatists can never split region","China Daily, 403 words",NA,2019-07-22
"308","More funds set aside for poverty fight","China Daily, 510 words",NA,2019-09-28
"309","King of Naan' succeeds on an industrial scale","China Daily, 425 words",NA,2019-08-14
"310","China plans to merge thermal power assets of State companies","China Daily, 629 words",NA,2019-12-04
"311","Rare wild mares looking for mates","China Daily, 368 words",NA,2019-06-12
"312","High-tech solution for garbage spawns market","China Daily, 458 words",NA,2019-08-19
"313","Beijing slams US defense act targeting China","China Daily, 666 words",NA,2019-12-23
"314","Governance key to national security","China Daily, 780 words",NA,2019-12-28
"315","Blacklisting of Chinese tech companies slammed","China Daily, 570 words",NA,2019-10-09
"316","Riding high on renewed wave of equestrian enthusiasm","China Daily, 588 words",NA,2019-10-09
"317","Vocational Education and Training in Xinjiang","China Daily, 7755 words",NA,2019-08-17
"318","Success in curbing terrorism leads to social harmony","China Daily, 502 words",NA,2019-09-07
"319","CNPC completes oil well drilling work in Tarim","China Daily, 451 words",NA,2019-07-30
"320","Red willow whiz's work pays dividends in desert","China Daily, 1109 words",NA,2019-07-22
"321","Campaign targets privacy problems on smartphone apps","China Daily, 646 words",NA,2019-11-12
"322","Xi: Phase one deal benefits whole world","China Daily, 672 words",NA,2019-12-23
"323","Experts defend anti-terrorism effort in Xinjiang","China Daily, 478 words",NA,2019-07-30
"324","Capital shares wealth by revitalizing rural areas, tackling poverty head-on","China Daily, 585 words",NA,2019-10-01
"325","SF embraces tech to tap demand for fresh food products","China Daily, 808 words",NA,2020-01-22
"326","Eat beat","China Daily, 343 words",NA,2019-04-20
"327","China will strengthen anti-terror efforts with Kyrgyzstan","China Daily, 394 words",NA,2019-05-23
"328","Journalists cite progress in fight against terrorism","China Daily, 1156 words",NA,2019-07-24
"329","Towering discoveries","China Daily, 1435 words",NA,2019-12-03
"330","Cherries from Central Asia gaining popularity","China Daily, 423 words",NA,2019-06-19
"331","In a first, three surgeries conducted using robots, 5G","China Daily, 516 words",NA,2019-08-29
"332","Heavy rains to sweep country this week","China Daily, 390 words",NA,2019-05-06
"333","World-class' deposit of lithium found, could ease reliance on imports","China Daily, 408 words",NA,2019-06-05
"334","Child-friendly destinations hot among summer travelers","China Daily, 480 words",NA,2019-07-15
"335","Stability, development transform Xinjiang","China Daily, 512 words",NA,2019-07-31
"336","Austrian Sinologist lauds old wisdom as good for the world","China Daily, 542 words",NA,2019-09-18
"337","Xinjiang discharges reservoir water in another effort to revive Tarim River","China Daily, 498 words",NA,2019-08-29
"338","Muslims need to be more cautious about Western propaganda on Xinjiang","China Daily, 893 words",NA,2020-02-24
"339","West is the emerging destination in China for investment","China Daily, 592 words",NA,2019-09-04
"340","What they say","China Daily, 474 words",NA,2019-06-21
"341","Award-winning photo highlights perils of life on the prairie","China Daily, 602 words",NA,2019-10-21
"342","Nation's first wildlife overpass to open","China Daily, 455 words",NA,2019-06-25
"343","Xinjiang policy in the best interest of local ethnicities","China Daily, 477 words",NA,2019-07-15
"344","Program offers natural response to office stress","China Daily, 753 words",NA,2020-01-22
"345","Xinjiang assistance targets livelihoods","China Daily, 482 words",NA,2019-07-17
"346","High-temperature vehicle testing site set up in Xinjiang","China Daily, 515 words",NA,2019-08-02
"347","Entrepreneur helps lift villagers out of poverty","China Daily, 919 words",NA,2020-02-26
"348","Time-honored Silk Road partnership renewed","China Daily, 491 words",NA,2019-07-04
"349","Construction company banks on technology to boost fortunes","China Daily, 575 words",NA,2019-08-20
"350","Villagers' incomes blossom with flower planting","China Daily, 611 words",NA,2019-09-27
"351","Meituan unveils new program to help farmers in less affluent areas","China Daily, 646 words",NA,2019-09-26
"352","Combining forces","China Daily, 634 words",NA,2019-08-17
"353","Ambassadors voice support for nation on issues related to Xinjiang","China Daily, 561 words",NA,2019-07-29
"354","West does not speak for international community","China Daily, 609 words",NA,2019-07-30
"355","Northwest area sees increasing precipitation","China Daily, 684 words",NA,2019-09-20
"356","Trade truce needed to avoid decoupling","China Daily, 840 words",NA,2019-12-23
"357","Official slams Washington's military bill","China Daily, 836 words",NA,2019-12-27
"358","Xinjiang policy subject to no one's slander","China Daily, 781 words",NA,2019-11-20
"359","Airline industry heading for summer boom","China Daily, 515 words",NA,2019-07-12
"360","Crackdown on gangs intensifies","China Daily, 448 words",NA,2019-05-08
"361","Rising demand for natural gas main driver of energy consumption growth","China Daily, 479 words",NA,2019-06-05
"362","Critics of Xinjiang policies politically motivated","China Daily, 598 words",NA,2019-07-30
"363","A NATURAL CALLING","China Daily, 1062 words",NA,2019-05-03
"364","Driving thousands of miles to reach Third Pole","China Daily, 630 words",NA,2019-10-04
"365","Japanese audience applauds Chinese classical performance","China Daily, 747 words",NA,2019-11-04
"366","Special corps on front line of agriculture","China Daily, 1373 words",NA,2019-08-15
"367","Pot smuggled from North America rises","China Daily, 533 words",NA,2019-06-18
"368","BRI benefits from opening-up efforts","China Daily, 553 words",NA,2019-06-24
"369","Foreign ministry defends UN visit to Xinjiang","China Daily, 518 words",NA,2019-06-18
"370","Ideal location to test the mettle of international athletes, electric cars","China Daily, 833 words",NA,2019-11-26
"371","Yuli 's all-round forest ranger","China Daily, 513 words",NA,2019-07-13
"372","Resettlement raises living standards","China Daily, 536 words",NA,2019-07-09
"373","International horticulture expo promotes capital's eco-friendly drive","China Daily, 504 words",NA,2019-05-16
"374","Digest","China Daily, 580 words",NA,2019-07-02
"375","Anti-poverty efforts encourage herdsmen","China Daily, 565 words",NA,2019-07-05
"376","Factories bring jobs for villagers to their doorstep","China Daily, 620 words",NA,2019-08-14
"377","North China to get relief from heat soon","China Daily, 536 words",NA,2019-07-05
"378","Volunteers lend a helping hand to Xinjiang patients","China Daily, 594 words",NA,2019-07-08
"379","Delivering five times the fun","China Daily, 792 words",NA,2019-11-21
"380","Country makes first stand at CIFTIS with 'Made in Azerbaijan '","China Daily, 530 words",NA,2019-05-31
"381","Senior official lauds benefits of environmental inspection","China Daily, 589 words",NA,2019-06-28
"382","CPEC brings power, better life to Pakistan","China Daily, 599 words",NA,2019-06-17
"383","Foreign scholars applaud China's anti-terror efforts","China Daily, 710 words",NA,2019-09-07
"384","Chinese doctors finding success at Pakistan center","China Daily, 718 words",NA,2019-09-03
"385","TV show draws China closer to Kyrgyzstan viewers","China Daily, 526 words",NA,2019-06-14
"386","Region transformed by tourism, preservation efforts","China Daily, 752 words",NA,2019-09-05
"387","HK braces itself for greater challenges in 2020","China Daily, 907 words",NA,2020-01-02
"388","Branding key to success of agricultural enterprises","China Daily, 600 words",NA,2019-06-11
"389","Embroiderer elevates Hami craft to haute couture","China Daily, 508 words",NA,2019-04-30
"390","Innovation makes souvenirs profitable","China Daily, 1251 words",NA,2019-05-02
"391","37 envoys write to back China on human rights","China Daily, 695 words",NA,2019-07-15
"392","Vegas stakes high for China's UFC warriors","China Daily, 1109 words",NA,2020-03-06
"393","What's news","China Daily, 870 words",NA,2019-11-22
"394","To know China better, make more efforts","China Daily, 956 words",NA,2019-12-19
"395","Heavy rain heads south after battering north","China Daily, 590 words",NA,2019-07-08
"396","IRU hopes to further facilitate road transport links","China Daily, 530 words",NA,2019-04-25
"397","First Sino- Kazakh film portrays last years of famed musician","China Daily, 530 words",NA,2019-05-16
"398","Xinjiang on the road to modern governance","China Daily, 685 words",NA,2019-06-25
"399","ADB to back domestic projects","China Daily, 837 words",NA,2019-09-03
"400","Impoverished. Isolated. Now they have a life","China Daily, 855 words",NA,2019-09-30
"401","President's May Fourth call heard at universities","China Daily, 575 words",NA,2019-05-02
"402","Overseas students flood in to study ancient Chinese therapies","China Daily, 550 words",NA,2019-04-25
"403","Trials underway for saltwater rice strains","China Daily, 683 words",NA,2019-06-10
"404","Emerging from the solitude of silence","China Daily, 906 words",NA,2019-11-13
"405","West's smearing of Xinjiang policy hypocritical","China Daily, 939 words",NA,2019-10-14
"406","Music, it should be noted, can be a truly powerful healer","China Daily, 654 words",NA,2019-07-17
"407","Japanese travel lover now calls China home","China Daily, 742 words",NA,2019-08-07
"408","Nation rallies to satisfy Hubei 's appetite","China Daily, 1535 words",NA,2020-03-27
"409","Expo highlights China-Africa cooperation","China Daily, 747 words",NA,2019-06-28
"410","All ethnic groups in Xinjiang fully enjoy human rights","China Daily, 760 words",NA,2019-07-01
"411","Xinjiang beckoning RV lovers","China Daily, 596 words",NA,2019-05-13
"412","Overseas media applaud rural development, anti-terrorism efforts","China Daily, 844 words",NA,2019-08-26
"413","Emerging from the solitude of silence","China Daily, 930 words",NA,2019-11-13
"414","Guangxi a key cog in success of trade route","China Daily, 916 words",NA,2019-09-20
"415","When it comes to human rights, US barks up the wrong tree","China Daily, 736 words",NA,2019-07-16
"416","When it comes to human rights, US barks up the wrong tree","China Daily, 749 words",NA,2019-07-16
"417","Cherishing China's rich athletic heritage","China Daily, 842 words",NA,2019-09-16
"418","Students stage musical to honor a late composer","China Daily, 738 words",NA,2019-07-17
"419","Chinese producer revives Tajik cotton industry","China Daily, 761 words",NA,2019-06-24
"420","Snow sports get warm reception","China Daily, 1025 words",NA,2019-10-29
"421","Ambassador lauds China's achievements","China Daily, 980 words",NA,2019-09-11
"422","Expo highlights China-Africa cooperation","China Daily, 774 words",NA,2019-06-28
"423","Former French diplomat aids companies' efforts to foster overseas relationships","China Daily, 1315 words",NA,2020-01-26
"424","Telemedicine provides remote help for patients","China Daily, 792 words",NA,2019-06-25
"425","Turkey looks to improve ties with China","China Daily, 742 words",NA,2019-07-02
"426","China pushing to get more books in global market","China Daily, 731 words",NA,2019-06-21
"427","All-Chinese women's team summit Mt Qomolangma","China Daily, 742 words",NA,2019-06-15
"428","Students stage musical to honor a late composer","China Daily, 752 words",NA,2019-07-17
"429","Handmade and homemade for success","China Daily, 1092 words",NA,2019-10-22
"430","Fresh water replenishes China's longest inland river","China Daily, 711 words",NA,2019-05-23
"431","Fighting terror to protect human rights","China Daily, 911 words",NA,2019-06-21
"432","Man shares 'wealth of books'","China Daily, 644 words",NA,2019-05-22
"433","Epic series on small screen","China Daily, 862 words",NA,2019-07-25
"434","Man shares 'wealth of books'","China Daily, 658 words",NA,2019-05-22
"435","Xinjiang vocational schools offering hope","China Daily, 898 words",NA,2019-08-17
"436","Cloudy outlook brings sunshine to online group","China Daily, 956 words",NA,2019-09-13
"437","Helping rural kids get their kicks","China Daily, 667 words",NA,2019-05-09
"438","Powering to a cleaner and greener future","China Daily, 985 words",NA,2019-08-12
"439","Cloudy outlook brings sunshine to online group","China Daily, 1023 words",NA,2019-09-13
"440","Infrastructure set to play crucial role","China Daily, 825 words",NA,2019-04-30
"441","What's news","China Daily, 1083 words",NA,2019-09-18
"442","Music makeover for Qingdao","China Daily, 929 words",NA,2019-07-20
"443","DIY projects entice many to pick up","China Daily, 1179 words",NA,2019-10-04
"444","Seeding epic growth with nuts","China Daily, 797 words",NA,2019-04-22
"445","DIY projects entice many to pick up","China Daily, 1126 words",NA,2019-10-04
"446","New yak breed brings herders renewed hope","China Daily, 961 words",NA,2019-07-08
"447","AstraZeneca publishes its first philanthropy white paper","China Daily, 1104 words",NA,2019-06-12
"448","New ideas to preserve the past","China Daily, 1041 words",NA,2019-05-28
"449","New ideas to preserve the past","China Daily, 1014 words",NA,2019-05-28
"450","From screen to grill","China Daily, 1196 words",NA,2019-08-30
"451","Restrictions, criticism faced by dog owners","China Daily, 1477 words",NA,2019-11-01
"452","AstraZeneca publishes its first philanthropy white paper","China Daily, 1168 words",NA,2019-06-11
"453","METEORITE HUNTERS CHASE THEIR DREAMS","China Daily, 1505 words",NA,2019-10-24
"454","REVELING IN GLOBAL LEGACY OF THE SILK ROAD","China Daily, 1297 words",NA,2019-08-09
"455","China Railway Express in Chengdu boosts regional economy","China Daily, 1017 words",NA,2019-04-26
"456","China Railway Express in Chengdu boosts regional economy","China Daily, 991 words",NA,2019-04-26
"457","Veteran kebab-maker still full of passion","China Daily, 880 words",NA,2019-05-01
"458","Champion of culture","China Daily, 1228 words",NA,2019-06-11
"459","Shooting stars from the city","China Daily, 1346 words",NA,2019-07-26
"460","Champion of culture","China Daily, 1188 words",NA,2019-06-11
"461","New Silk Road helps wealth bloom in desert","China Daily, 1496 words",NA,2019-08-14
"462","Outdoor activity trend drives higher accident rate","China Daily, 1299 words",NA,2019-07-10
"463","Driving an energy revolution","China Daily, 1307 words",NA,2019-05-23
"464","NATION PUTTING ITS BEST SPORTING FOOT FORWARD","China Daily, 1528 words",NA,2019-08-08
"465","Institute at forefront of infectious diseases fight","China Daily, 1785 words",NA,2019-09-26
"466","Nation's flower power in full bloom","China Daily, 1441 words",NA,2019-05-10
"467","US connives with terrorists for self-interest","China Daily, 2840 words",NA,2019-12-06
"468","Winds of change sweep offshore power","China Daily, 1383 words",NA,2019-04-22
"469","Latest on the novel coronavirus outbreak","China Daily, 5053 words",NA,2020-02-28
"470","MEDICAL WORKERS PUT THEIR LIVES ON THE LINE","China Daily, 2308 words",NA,2019-08-29
"471","ENVIRONMENTAL MIGRANTS FIND ARABLE LAND, JOBS","China Daily, 1840 words",NA,2019-07-10
"472","Latest on the novel coronavirus outbreak","China Daily, 5438 words",NA,2020-02-29
"473","Cultural crossroads","China Daily, 1930 words",NA,2019-07-09
"474","Cultural crossroads","China Daily, 1984 words",NA,2019-07-09
"475","WISDOM of the AGED","China Daily, 2393 words",NA,2019-09-26
"476","Training strengthened for bilingual ethnic legal officials","China Daily, 1740 words",NA,2019-05-08
"477","BRI prompts closer global scientific cooperation","China Daily, 1848 words",NA,2019-04-29
"478","Dialogue to bring civilizations closer","China Daily, 2431 words",NA,2019-05-16
"479","Seeking Happiness for People: 70 Years of Progress on Human Rights in China","China Daily, 18427 words",NA,2019-09-23
"480","China's National Defense in the New Era","China Daily, 15129 words",NA,2019-07-25
"481","China's National Defense in the New Era","China Daily, 15331 words",NA,2019-07-25
"482","Mobile CT unit set up in Xinjiang","China Daily, 151 words",NA,2020-02-28
"483","Xinjiang encourages home fitness during novel coronavirus outbreak","China Daily, 156 words",NA,2020-02-12
"484","Freight train service to Poland commences","China Daily, 147 words",NA,2019-12-27
"485","Tang-era Han tombs found in eastern Xinjiang","China Daily, 147 words",NA,2019-12-12
"486","5.6 magnitude earthquake hits southern Xinjiang","China Daily, 26 words",NA,2020-01-16
"487","Amazing China: The vast grassland under the Tianshan mountains","China Daily, 38 words",NA,2020-01-16
"488","Amazing China: Flaming Mountains and Grape Valley","China Daily, 50 words",NA,2020-02-08
"489","Amazing China: Mysterious Kanas Lake","China Daily, 59 words",NA,2020-01-28
"490","Over 65 tons of donated beef leaves for Wuhan","China Daily, 93 words",NA,2020-03-01
"491","China sends medical experts to Pakistan","China Daily, 122 words",NA,2020-03-28
"492","Amazing China: A corridor of apricot blossom far from the sea","China Daily, 68 words",NA,2020-01-17
"493","Xinjiang medical worker lightens hospital mood with dance class","China Daily, 95 words",NA,2020-02-12
"494","Amazing China: Anjihai Grand Canyon","China Daily, 74 words",NA,2020-01-09
"495","Artist gets fuzzy feeling about animal hair","China Daily, 142 words",NA,2020-03-24
"496","Expressway construction resumes in Xinjiang","China Daily, 186 words",NA,2020-03-24
"497","Novel heroes: Female driver helps ferry medics in Wuhan","China Daily, 138 words",NA,2020-02-19
"498","Hunan , Yunnan discharge last confirmed COVID-19 patients","China Daily, 181 words",NA,2020-03-14
"499","Photo","China Daily, 44 words",NA,2019-08-17
"500","Man in Xinjiang donates horses to help Hubei","China Daily, 160 words",NA,2020-02-09
"501","China Southern flies 3,000 to workplaces around the country","China Daily, 194 words",NA,2020-03-11
"502","Photo","China Daily, 47 words",NA,2019-07-31
"503","Photo","China Daily, 77 words",NA,2019-08-08
"504","Xinjiang man climbs mountains to help Hubei","China Daily, 199 words",NA,2020-02-09
"505","On our Sina Weibo","China Daily, 188 words",NA,2019-07-05
"506","Uygur man reaps rewards of new industries","China Daily, 443 words",NA,2021-01-18
"507","Muslims should know whose interests Uygur separatists serve","China Daily, 852 words",NA,2020-10-13
"508","Xinjiang 's Uygur population rising, not declining, official says","China Daily, 649 words",NA,2020-08-29
"509","Uygur brothers turn the valve on poverty alleviation","China Daily, 324 words",NA,2020-11-03
"510","Naan industrial park gives Uygur people a new start","China Daily, 503 words",NA,2020-09-19
"511","Uygur makes fortune by expanding melon markets","China Daily, 660 words",NA,2020-09-15
"512","Xinjiang 's achievements impress visiting envoys","China Daily, 588 words",NA,2021-04-03
"513","US' attempt to smear China through Uygur bill will not succeed","China Daily, 502 words",NA,2020-06-19
"514","US up to old tricks in trying to influence Xinjiang cotton industries","China Daily, 535 words",NA,2021-03-28
"515","Xinjiang official criticizes EU move","China Daily, 356 words",NA,2021-03-19
"516","Ministry: 'Genocide in Xinjiang ' another US lie","China Daily, 428 words",NA,2021-04-01
"517","Birth trend in Xinjiang due to progress","China Daily, 538 words",NA,2021-01-08
"518","US fabricating lies about Xinjiang rights abuses, report says","China Daily, 674 words",NA,2021-01-06
"519","Official hits back over Xinjiang accusations","China Daily, 404 words",NA,2021-03-27
"520","Western brands unwise to be a cat's paw","China Daily, 841 words",NA,2021-03-29
"521","FM rejects rights accusations in Xinjiang","China Daily, 718 words",NA,2021-02-24
"522","US footwear brand Skechers : no evidence of Xinjiang 'forced labor'","China Daily, 248 words",NA,2021-03-27
"523","BBC 's false China-related news reports over the last 2 years","China Daily, 316 words",NA,2021-02-22
"524","Report rebukes claims on Xinjiang","China Daily, 500 words",NA,2021-03-24
"525","Testimonies of Xinjiang 'mass rape victim' proven to be full of loopholes","China Daily, 1118 words",NA,2021-02-19
"526","Hyping lies about Xinjiang will always exact a price: China Daily editorial","China Daily, 516 words",NA,2021-03-28
"527","Xinjiang 's economic, social development praised","China Daily, 494 words",NA,2021-02-04
"528","Lawsuit filed against German anti-China figure for Xinjiang rumors","China Daily, 252 words",NA,2021-03-09
"529","Claims of 'forced labor' in Xinjiang dismissed","China Daily, 466 words",NA,2020-12-22
"530","Truth and fabrication on Xinjiang 's population change","China Daily, 693 words",NA,2021-02-05
"531","Xinjiang official accuses BBC of lying, spreading rumors","China Daily, 402 words",NA,2021-02-11
"532","China condemns summoning of its envoys","China Daily, 586 words",NA,2021-03-25
"533","False claims aim to hurt prosperity of Xinjiang","China Daily, 801 words",NA,2021-03-29
"534","Two-faced' officials exposed in new Xinjiang documentary","China Daily, 372 words",NA,2021-04-02
"535","Dongguan companies giving boost to Xinjiang economy","China Daily, 240 words",NA,2020-12-25
"536","Journey to Xinjiang reveals biases of Western media","China Daily, 1476 words",NA,2020-11-23
"537","Last leg of China's longest east-west high-speed rail route opens","China Daily, 234 words",NA,2021-02-08
"538","By targeting Xinjiang , Canada barking up wrong tree","China Daily, 845 words",NA,2021-03-02
