"","Headline","Publication","Summary","Date"
"539","Allegation of genocide in Xinjiang the biggest lie in history","China Daily, 1083 words",NA,2021-03-01
"540","An Analysis Report on Population Change in Xinjiang","China Daily, 1469 words",NA,2021-01-07
"541","Official challenges birthrate assertions","China Daily, 432 words",NA,2021-01-12
"542","Top legislator spells out stance on Xinjiang , HK","China Daily, 417 words",NA,2021-03-26
"543","Flowers in the yard","China Daily, 410 words",NA,2020-10-16
"544","Spur for China's textile industry to upgrade","China Daily, 463 words",NA,2021-03-30
"545","Dongguan pours funds into development of city in south Xinjiang","China Daily, 624 words",NA,2021-01-04
"546","Report: Xinjiang textile workers' rights protected","China Daily, 573 words",NA,2021-02-01
"547","Sinopec finds gas, oil flows in Xinjiang","China Daily, 451 words",NA,2021-03-16
"548","Xinjiang 'genocide' talk doesn't bear scrutiny","China Daily, 336 words",NA,2020-09-07
"549","Spirit of craftsmanship should extend to all","China Daily, 489 words",NA,2021-03-12
"550","EU barking up the wrong tree: China Daily editorial","China Daily, 443 words",NA,2021-03-17
"551","Xinjiang cotton boycott US -led burlesque: China Daily editorial","China Daily, 505 words",NA,2021-03-31
"552","Adrian Zenz's lies on Xinjiang 's population debunked (6)","China Daily, 782 words",NA,2020-09-15
"553","Do foreign media hate China?' British netizens have the answer","China Daily, 433 words",NA,2021-03-05
"554","Expert rebuts forced 'birth control' claims","China Daily, 823 words",NA,2020-09-15
"555","Relocation policies move villagers out of poverty","China Daily, 305 words",NA,2021-01-19
"556","Mechanization of Xinjiang 's cotton sector approaches 90%","China Daily, 552 words",NA,2021-04-02
"557","Beijing rips London for 'trick' at UN on Xinjiang","China Daily, 437 words",NA,2021-02-25
"558","Tech makes things easier in northwest cotton fields","China Daily, 571 words",NA,2021-03-27
"559","Experts hit out over US legislation on Uygurs","China Daily, 616 words",NA,2020-06-22
"560","Western media should stop living in the past","China Daily, 410 words",NA,2021-02-10
"561","Water a precious commodity in Xinjiang 's Qira county","China Daily, 212 words",NA,2020-11-19
"562","Birthrate for Uygurs is No 1 in Xinjiang","China Daily, 519 words",NA,2020-09-04
"563","Canada using human rights as fig leaf to cover its shame: China Daily editorial","China Daily, 494 words",NA,2021-03-02
"564","International mail up 50% in NW China's Xinjiang","China Daily, 258 words",NA,2020-11-17
"565","Foreigners welcomed to see truth for themselves","China Daily, 461 words",NA,2021-02-02
"566","Analysis: Report on Xinjiang full of holes","China Daily, 491 words",NA,2020-09-17
"567","Washington urged to end import ban on Xinjiang","China Daily, 386 words",NA,2021-01-15
"568","Xinjiang rebuts claims about 'racial genocide'","China Daily, 838 words",NA,2020-08-31
"569","Fishery thrives in landlocked Xinjiang","China Daily, 435 words",NA,2021-01-19
"570","A First Farewell': Trailer","China Daily, 211 words",NA,2020-08-04
"571","Western media's disinformation campaign - two tales, one Xinjiang","China Daily, 477 words",NA,2021-01-25
"572","Hot for cold","China Daily, 394 words",NA,2020-12-29
"573","World's smallest stegosaurus track found in Xinjiang","China Daily, 220 words",NA,2021-03-09
"574","Hard work, new skills improve villagers' lives","China Daily, 956 words",NA,2021-03-03
"575","Xinjiang : 2 confirmed, 116 asymptomatic virus cases","China Daily, 277 words",NA,2020-11-04
"576","Xinjiang's autumnal allure","China Daily, 252 words",NA,2020-10-27
"577","Former Xinjiang deputy chair expelled from CPC","China Daily, 332 words",NA,2020-11-30
"578","Xinjiang responding to allegations with contentment","China Daily, 953 words",NA,2021-02-17
"579","BBC deserves the penalty it gets","China Daily, 493 words",NA,2021-02-12
"580","Secretary of chile ' sows the seeds of progress","China Daily, 427 words",NA,2020-10-20
"581","Adrian Zenz's lies on Xinjiang 's population debunked (3)","China Daily, 1148 words",NA,2020-09-14
"582","Boycott set to severely harm global supply chain","China Daily, 753 words",NA,2021-03-27
"583","Truth of Xinjiang speaks louder than slander","China Daily, 457 words",NA,2020-12-28
"584","Xinjiang 'genocide' lie desperate gambit of West","China Daily, 730 words",NA,2021-03-27
"585","From the ground, up","China Daily, 295 words",NA,2020-10-21
"586","New skills see almond growers lift incomes","China Daily, 571 words",NA,2021-01-25
"587","Humble nang becomes big business for Xinjiang bakers","China Daily, 389 words",NA,2020-09-25
"588","China shares true picture of Xinjiang with Malaysia","China Daily, 298 words",NA,2021-03-19
"589","Relocation changes lifestyle, mindset of Xinjiang residents","China Daily, 479 words",NA,2020-09-28
"590","More countries join China in rebuking Western claims","China Daily, 837 words",NA,2021-03-30
"591","New choir hits the high notes for Party's anniversary","China Daily, 276 words",NA,2021-03-10
"592","Xi's vision of shared destiny draws applause","China Daily, 268 words",NA,2021-03-05
"593","Mass testing finds over 700 camel pregnancies","China Daily, 379 words",NA,2020-11-27
"594","Adrian Zenz's lies on Xinjiang 's population debunked (5)","China Daily, 1168 words",NA,2020-09-15
"595","Xinjiang villagers see huge changes after relocation","China Daily, 655 words",NA,2020-09-28
"596","City dwellers tell the story of their hometowns in documentary","China Daily, 248 words",NA,2021-03-02
"597","Progress, Xinjiang 's answers to those who slam it","China Daily, 458 words",NA,2020-09-18
"598","Genocide claim in Xinjiang a rumor fabricated with ulterior motives","China Daily, 781 words",NA,2021-03-11
"599","Xinjiang targets transportation","China Daily, 603 words",NA,2021-02-02
"600","An analysis of American interference in Xinjiang affairs under the context of human rights protection - A research report from the perspective of Xinjiang 's population","China Daily, 561 words",NA,2021-01-06
"601","Xinjiang schools to resume operation","China Daily, 215 words",NA,2020-09-04
"602","Martyrs' graveyards welcome new tourists","China Daily, 339 words",NA,2021-04-05
"603","China-Europe train departs with 200,000 Singles Day parcels","China Daily, 376 words",NA,2020-11-05
"604","US politicians like 'genocide' because they have done it many times","China Daily, 584 words",NA,2021-01-30
"605","China increases efficiency of consumer rights protection","China Daily, 342 words",NA,2021-03-16
"606","Latest on the novel coronavirus outbreak","China Daily, 1716 words",NA,2020-08-12
"607","Further Kashgar transmission of virus seen as unlikely","China Daily, 371 words",NA,2020-10-29
"608","Xinjiang will protect human rights, ensure all ethnic groups live a life of dignity","China Daily, 839 words",NA,2020-09-30
"609","Stop spinning Xinjiang cotton yarns","China Daily, 348 words",NA,2021-03-26
"610","Ban on Ramadan fasting 'nonsense', Xinjiang says","China Daily, 522 words",NA,2020-06-02
"611","Xinjiang training center grads refute rumors from West","China Daily, 365 words",NA,2020-10-31
"612","Woman leads fellow Xinjiang villagers out of poverty","China Daily, 425 words",NA,2020-12-08
"613","In cold Xinjiang gas field, foxes are family","China Daily, 660 words",NA,2021-02-27
"614","5 Kashgar COVID cases symptomatic","China Daily, 393 words",NA,2020-10-28
"615","Field of dreams far from home","China Daily, 274 words",NA,2020-09-09
"616","Bid to weaken cotton sector fated to fail","China Daily, 923 words",NA,2021-03-31
"617","Report: Livestreaming surged in 2020","China Daily, 259 words",NA,2021-02-03
"618","Xinjiang legislature says US act a piece of waste paper","China Daily, 301 words",NA,2020-06-18
"619","Canadian YouTuber explains why the West is targeting Xinjiang","China Daily, 352 words",NA,2021-03-26
"620","Report refutes 'forced labor' accusations","China Daily, 735 words",NA,2020-10-27
"621","Adrian Zenz's lies on Xinjiang 's population debunked (1)","China Daily, 1073 words",NA,2020-09-14
"622","Domestic film 'A First Farewell' wins hearts, box office","China Daily, 566 words",NA,2020-08-04
"623","Much needed relief for small and micro firms","China Daily, 363 words",NA,2021-03-09
"624","Xinjiang records positive development in fight against COVID-19","China Daily, 232 words",NA,2020-08-09
"625","Western media's portrayal of training centers far from truth","China Daily, 321 words",NA,2021-02-05
"626","Manufacturers must move up the value chain","China Daily, 443 words",NA,2021-04-02
"627","Planting fruit helps bring prosperity to Aksu in Xinjiang","China Daily, 699 words",NA,2021-01-14
"628","Does Xinjiang suppress religious beliefs?","China Daily, 421 words",NA,2021-03-17
"629","So-called Xinjiang population report full of lies","China Daily, 1802 words",NA,2020-09-04
"630","Freedom of religious belief fully protected in Xinjiang , says report","China Daily, 462 words",NA,2020-11-03
"631","Western media unlocked: Unmasking hypocrisy and propaganda","China Daily, 417 words",NA,2020-10-10
"632","Growing of seawater rice to be greatly expanded","China Daily, 683 words",NA,2021-01-16
"633","Xinjiang border port pushes efficiency","China Daily, 261 words",NA,2020-08-04
"634","Train from Chongqing marks European anniversary","China Daily, 438 words",NA,2021-03-22
"635","Authorities retrieve 31,000 cultural relics","China Daily, 445 words",NA,2021-03-25
"636","Intl parcel volume exceeds 20 million at Alataw Pass port in NW China","China Daily, 363 words",NA,2020-07-06
"637","Thousands of safe new homes on track for Xinjiang","China Daily, 328 words",NA,2020-09-22
"638","Cotton-picking champion has plans to branch out","China Daily, 397 words",NA,2020-10-30
"639","Report says BRI faces new challenges","China Daily, 449 words",NA,2021-03-25
"640","Washington stoops to new low with its condoning terrorists: China Daily editorial","China Daily, 475 words",NA,2020-11-09
"641","White paper focuses on job security in Xinjiang","China Daily, 610 words",NA,2020-09-18
"642","Western public opinion misled by specter of McCarthyism","China Daily, 422 words",NA,2021-03-15
"643","New diplomacy for a confident, rising nation","China Daily, 400 words",NA,2021-03-11
"644","New Xinjiang COVID-19 outbreak unrelated to previous episode","China Daily, 496 words",NA,2020-11-06
"645","Last leg of east-west rail corridor opens","China Daily, 315 words",NA,2021-02-09
"646","Passion for marigolds plants roots of success","China Daily, 672 words",NA,2020-09-29
"647","Educational situation of Xinjiang Uygur Muslims has got improved","China Daily, 1702 words",NA,2020-04-17
"648","Use of Xinjiang satellite images 'misleading'","China Daily, 591 words",NA,2020-11-30
"649","Better livelihoods boost happiness in Xinjiang","China Daily, 412 words",NA,2020-09-21
"650","Xinjiang 's confirmed virus cases show slowdown","China Daily, 291 words",NA,2020-08-02
"651","When chickens arrived, people prospered","China Daily, 522 words",NA,2020-11-18
"652","CPPCC slams US for siding with terrorists","China Daily, 415 words",NA,2020-06-18
"653","Fact check: People held in custody not religious faculty staff","China Daily, 438 words",NA,2021-03-12
"654","Urumqi vows financial aid to groups struggling against COVID-19","China Daily, 253 words",NA,2020-07-25
"655","Kazak embroidery threads way out of poverty for women","China Daily, 207 words",NA,2020-06-27
"656","CNPC uses resources for poverty alleviation","China Daily, 399 words",NA,2020-09-15
"657","Domestic focus gives fillip to tourism industry","China Daily, 582 words",NA,2020-11-24
"658","Dear BBC , bad-mouthing China can't be news","China Daily, 350 words",NA,2021-02-18
"659","Companies should shun anti-China ploys: China Daily editorial","China Daily, 458 words",NA,2021-03-24
"660","Xinjiang to operate 26 chartered tour trains","China Daily, 378 words",NA,2020-09-11
"661","COVID-19 cases pass 160 in Kashgar amid mass testing","China Daily, 465 words",NA,2020-10-27
"662","Free to blame China, not free to defend it?","China Daily, 396 words",NA,2021-03-12
"663","Xinjiang progress key to national unity","China Daily, 815 words",NA,2020-09-29
"664","Fact check: No demolition of mosques or religious places","China Daily, 436 words",NA,2021-03-10
"665","Common Xinjiang food boosts farmers' incomes","China Daily, 721 words",NA,2020-09-30
"666","E-commerce sites pull H&M products after company's Xinjiang statement","China Daily, 485 words",NA,2021-03-24
"667","China has to defend Xinjiang cotton","China Daily, 471 words",NA,2021-03-26
"668","Adrian Zenz's lies on Xinjiang 's population debunked (4)","China Daily, 702 words",NA,2020-09-15
"669","Xinjiang woman hooks into success with fish breeding","China Daily, 213 words",NA,2020-06-23
"670","Xinjiang man gives back to community with elder care","China Daily, 472 words",NA,2020-10-26
"671","Employment and Labor Rights in Xinjiang","China Daily, 1749 words",NA,2020-09-18
"672","Citywide testing proves effective in containing Urumqi outbreak","China Daily, 336 words",NA,2020-08-06
"673","Heavy rains set to ease droughts in south and east","China Daily, 361 words",NA,2021-02-10
"674","Xinjiang denies report about passports for Uygurs","China Daily, 566 words",NA,2020-04-30
"675","Adrian Zenz's lies on Xinjiang 's population debunked (2)","China Daily, 720 words",NA,2020-09-14
"676","Xinjiang pours money into social services","China Daily, 210 words",NA,2020-05-22
"677","Nation reports its highest daily case total in 3 months","China Daily, 319 words",NA,2020-07-30
"678","Xinjiang spurs tourism revival after overcoming virus outbreak","China Daily, 450 words",NA,2020-09-21
"679","Evidence' of Muslims being suppressed 'utter nonsense', Xinjiang officials say","China Daily, 647 words",NA,2020-11-20
"680","Self-driving the new way to holiday","China Daily, 373 words",NA,2021-02-17
"681","Report: Faith fully respected in Xinjiang","China Daily, 585 words",NA,2020-11-04
"682","EU should not let investment deal be hijacked: China Daily editorial","China Daily, 481 words",NA,2021-03-28
"683","Urumqi to carry out citywide free nucleic acid testing","China Daily, 328 words",NA,2020-07-18
"684","Urumqi carries out new targeted round of testing","China Daily, 343 words",NA,2020-08-05
"685","Xinjiang women see more opportunities","China Daily, 1046 words",NA,2021-03-09
"686","Kashgar reports 138 new COVID cases","China Daily, 540 words",NA,2020-10-26
"687","Reduce poverty and protect human rights","China Daily, 853 words",NA,2020-09-25
"688","China firmly opposes Xinjiang -related bill signed by Trump","China Daily, 278 words",NA,2020-06-18
"689","For villagers in northern Xinjiang , wealth sprouts from fields of lavender","China Daily, 940 words",NA,2021-02-08
"690","No 'forced labor' in Xinjiang , report finds","China Daily, 585 words",NA,2020-10-20
"691","Xinjiang workers deny forced labor claims","China Daily, 568 words",NA,2020-11-13
"692","Fact check: Alleged Xinjiang 'detention centers' anything but","China Daily, 263 words",NA,2020-11-30
"693","NGO certification being weaponized: China Daily editorial","China Daily, 551 words",NA,2021-03-29
"694","Dinosaurs that left tracks in stone identified","China Daily, 261 words",NA,2020-06-09
"695","Xinjiang 'population issue' criticized","China Daily, 498 words",NA,2020-09-26
"696","Xi vows greater solidarity amid virus","China Daily, 534 words",NA,2021-03-17
"697","New COVID-19 cases falling in Xinjiang","China Daily, 383 words",NA,2020-08-03
"698","Documentary nails West's lies on Xinjiang 's fight against terrorism","China Daily, 803 words",NA,2020-09-02
"699","Solar park brings succor to Qinghai","China Daily, 466 words",NA,2021-02-23
"700","Xinjiang unveils events to mark national cultural day","China Daily, 295 words",NA,2020-06-13
"701","Xinjiang resuming normalcy after outbreak","China Daily, 476 words",NA,2020-09-03
"702","Year-end auto sales boom to continue through January","China Daily, 338 words",NA,2021-01-12
"703","Foreign ministry slams 'doomsday clown' Pompeo","China Daily, 380 words",NA,2021-01-21
"704","National Day holiday expected to inject new growth for tourism","China Daily, 498 words",NA,2020-09-27
"705","Ministry speaks out against US interference","China Daily, 394 words",NA,2021-01-05
"706","Xinjiang COVID-19 outbreak expected to slow: Public health expert","China Daily, 652 words",NA,2020-07-20
"707","Eight new coronavirus cases reported in Xinjiang","China Daily, 408 words",NA,2020-07-22
"708","UK urged to refrain from false accusations","China Daily, 367 words",NA,2020-07-21
"709","Urumqi outbreak expected to slow down","China Daily, 394 words",NA,2020-07-21
"710","Stance on climate change lauded","China Daily, 288 words",NA,2020-11-30
"711","Xi hails major progress made in Xinjiang","China Daily, 575 words",NA,2020-09-28
"712","Xinjiang records record-high COVID-19 recoveries","China Daily, 412 words",NA,2020-08-04
"713","Act exposes US 'tolerance' for terrorism","China Daily, 815 words",NA,2020-06-20
"714","After virus fight, Xinjiang gives tourism a push","China Daily, 507 words",NA,2020-09-15
"715","Report accuses US of double standard","China Daily, 685 words",NA,2020-11-11
"716","Refutation of all Xinjiang charges: China Daily editorial","China Daily, 565 words",NA,2020-09-28
"717","Uyghurs a bargaining chip in US -China trade war","China Daily, 927 words",NA,2021-01-11
"718","Xinjiang successful in containing terrorism, CPPCC member says","China Daily, 297 words",NA,2020-05-24
"719","Xinjiang benefits from dean's textile training project","China Daily, 635 words",NA,2020-10-13
"720","Regulation details hajj procedures for Chinese Muslims","China Daily, 239 words",NA,2020-10-12
"721","Tunnel drilled on major China railway","China Daily, 211 words",NA,2020-10-09
"722","Canada urged to reset relations with China","China Daily, 596 words",NA,2021-03-04
"723","Documentary traces the colorful history of Xinjiang","China Daily, 482 words",NA,2021-01-28
"724","CIIE trading platform to reach more regions outside Shanghai","China Daily, 267 words",NA,2020-11-05
"725","New maglev lines to cut travel time to Guangzhou","China Daily, 517 words",NA,2021-02-23
"726","Employment progress in Xinjiang key to social stability, experts say","China Daily, 584 words",NA,2020-09-22
"727","Xinjiang import ban applied prejudice: China Daily editorial","China Daily, 571 words",NA,2020-09-09
"728","Best of the northwest","China Daily, 281 words",NA,2020-11-03
"729","Huge potential seen in wind, solar power growth","China Daily, 485 words",NA,2021-02-05
"730","People's rights fully respected in Xinjiang","China Daily, 1644 words",NA,2021-01-14
"731","Villagers in southern Xinjiang escape poverty through grapevine","China Daily, 678 words",NA,2020-10-20
"732","Orange cold wave warning issued as freezing temperatures sweep across nation","China Daily, 352 words",NA,2020-12-28
"733","Participation in winter activities snowballing as Beijing Games near","China Daily, 618 words",NA,2021-03-16
"734","Pinduoduo employee's death sparks labor probe","China Daily, 391 words",NA,2021-01-06
"735","Ministry blasts US for visa policy attacks","China Daily, 385 words",NA,2020-12-23
"736","Xinjiang farmers get a lift from Anhui","China Daily, 342 words",NA,2020-05-29
"737","No forced labor in Xinjiang , report says","China Daily, 700 words",NA,2020-10-21
"738","US sanctions on Xinjiang firms are an 'act of blatant bullying'","China Daily, 705 words",NA,2020-10-17
"739","Import-export paperwork streamlined in Xinjiang","China Daily, 328 words",NA,2020-05-13
"740","Diplomat: View development in objective way","China Daily, 611 words",NA,2021-03-09
"741","Suez jam may spur freight train option","China Daily, 710 words",NA,2021-03-30
"742","Sanctions imposed on US entity, officials over Xinjiang -related issues","China Daily, 459 words",NA,2020-07-14
"743","What's on","China Daily, 357 words",NA,2020-11-30
"744","Documentary tells true story of Xinjiang training centers","China Daily, 596 words",NA,2020-08-26
"745","Beijing reports two imported COVID cases","China Daily, 275 words",NA,2020-10-26
"746","Ministry: Australia's stance 'a travesty of freedom and democracy'","China Daily, 361 words",NA,2020-12-03
"747","Train shipments build steam in Xinjiang","China Daily, 316 words",NA,2020-04-22
"748","NPC condemns Xinjiang -related bill signed by Trump","China Daily, 442 words",NA,2020-06-18
"749","Investigation Report on the Situation of Xinjiang Outbound Young Migrant Worker of all Ethnic Groups","China Daily, 848 words",NA,2020-10-27
"750","Villagers relish life in new houses","China Daily, 395 words",NA,2020-06-30
"751","Progress in quantum network realized","China Daily, 476 words",NA,2021-01-07
"752","Probe launched into domestic violence claims","China Daily, 521 words",NA,2021-02-08
"753","Ancient instrument strikes enchanting chord of opportunity in Xinjiang","China Daily, 280 words",NA,2020-11-09
"754","Variety show explores meaning of life in picturesque setting","China Daily, 293 words",NA,2020-11-05
"755","Xi says China opposes any intervention in its internal affairs","China Daily, 231 words",NA,2020-09-15
"756","Asian Americans 'screaming out for help'","China Daily, 684 words",NA,2021-03-20
"757","Wind blows sandstorm back to northern regions","China Daily, 689 words",NA,2021-03-18
"758","Forced labor claims unfounded","China Daily, 586 words",NA,2020-04-08
"759","Xinjiang reports record spike in COVID-19 patients","China Daily, 506 words",NA,2020-07-28
"760","Ministry slams US attempts to maintain its hegemony","China Daily, 514 words",NA,2021-01-14
"761","North experiences snow as rain drenches south","China Daily, 331 words",NA,2020-10-29
"762","ILO chief lauds China's commitment to poverty eradication goal","China Daily, 283 words",NA,2020-10-14
"763","Xinjiang looks to expand digital economy","China Daily, 406 words",NA,2020-06-02
"764","Driving homes away from home","China Daily, 278 words",NA,2020-10-13
"765","National carbon market to be expanded, strengthened","China Daily, 339 words",NA,2020-10-29
"766","China slams US enacting law on Uygurs","China Daily, 801 words",NA,2020-06-19
"767","US visa rules for CPC members opposed","China Daily, 391 words",NA,2020-12-04
"768","Officials slam US sanctions on Xinjiang products","China Daily, 1064 words",NA,2020-12-29
"769","One asymptomatic case diagnosed in Henan city","China Daily, 300 words",NA,2020-10-30
"770","Toxic legacy need not poison relations: China Daily editorial","China Daily, 469 words",NA,2021-01-05
"771","Uygurs not 'persecuted', Xinjiang spokesman says","China Daily, 446 words",NA,2020-12-11
"772","111 new cases confirmed in Urumqi","China Daily, 542 words",NA,2020-08-01
"773","A Report on Freedom of Religious Belief in Xinjiang","China Daily, 2596 words",NA,2020-11-03
"774","Forests answer carbon capture call","China Daily, 428 words",NA,2020-12-18
"775","Reading for better life","China Daily, 404 words",NA,2020-12-08
"776","Past resonates at ancient site on Silk Road","China Daily, 587 words",NA,2021-02-16
"777","Power sector charts new path to carbon-neutral future","China Daily, 341 words",NA,2020-10-22
"778","Documentary nails lies about Xinjiang","China Daily, 676 words",NA,2020-09-12
"779","Xinjiang records highest daily number of COVID recoveries","China Daily, 208 words",NA,2020-08-07
"780","Human rights a tool for US to maintain its hegemony","China Daily, 814 words",NA,2020-10-14
"781","Medical aid boosts Tibet and Xinjiang healthcare","China Daily, 478 words",NA,2020-12-16
"782","Xinjiang's railways see surging cotton freight amid epidemic","China Daily, 201 words",NA,2020-08-07
"783","African swine fever vaccine research progressing well","China Daily, 251 words",NA,2020-08-18
"784","Cui: China not looking to rule the world","China Daily, 823 words",NA,2021-03-26
"785","Home price stabilityï¼goal's for real","China Daily, 658 words",NA,2021-02-01
"786","Clean water? Villagers can drink to that","China Daily, 521 words",NA,2020-07-20
"787","Xinjiang rejects US' report on mosques","China Daily, 593 words",NA,2020-07-18
"788","Expert: US policy on Taiwan set to become more predictable under Biden","China Daily, 586 words",NA,2021-02-05
"789","Pakistan 's ambassador praises XPCC's role in Xinjiang development","China Daily, 406 words",NA,2020-11-09
"790","Track-laying progresses in Xinjiang","China Daily, 406 words",NA,2020-05-13
"791","Wastewater feeds a forest in arid zone","China Daily, 400 words",NA,2020-05-08
"792","Inner Mongolian herders benefit from vet services","China Daily, 439 words",NA,2020-12-09
"793","Forecasters predict winter will be colder","China Daily, 377 words",NA,2020-11-05
"794","SME indexes dip, reflecting seasonal, COVID slowdowns","China Daily, 741 words",NA,2021-02-19
"795","More teachers, factory workers sought","China Daily, 345 words",NA,2020-10-24
"796","Pandemic doesn't stop trains from carrying goods to Europe","China Daily, 578 words",NA,2021-01-29
"797","Culture trains to help fight remaining poverty","China Daily, 287 words",NA,2020-08-24
"798","Daily visitor caps demanded for ancient grotto temples","China Daily, 388 words",NA,2020-10-29
"799","Energy SOE taps into Mexico , Russia","China Daily, 467 words",NA,2020-11-27
"800","Temperatures set to plummet by up to 10 C","China Daily, 552 words",NA,2021-01-06
"801","Human rights well protected in Xinjiang","China Daily, 988 words",NA,2020-10-27
"802","Pinduoduo case shows need for reevaluating labor law in digital age","China Daily, 584 words",NA,2021-01-05
